{
  "eventId": "90000012-0000-4000-8000-000000000001",
  "eventType": "PolicyIssued",
  "eventVersion": 1,
  "occurredAt": "2026-09-27T10:00:00Z",
  "aggregateId": "44444444-4444-4444-8444-444444444444",
  "aggregateVersion": 1,
  "correlationId": "ejemplo-contrato",
  "producer": "policy-service",
  "data": {
    "policyId": "44444444-4444-4444-8444-444444444444",
    "quoteId": "33333333-3333-4333-8333-333333333333",
    "customerId": "11111111-1111-4111-8111-111111111111",
    "policyNumber": "POL-2026-44444444",
    "vehicleId": "22222222-2222-4222-8222-222222222222",
    "premium": 1412.5,
    "currency": "PEN",
    "startDate": "2026-10-01",
    "endDate": "2027-10-01",
    "status": "VIGENTE"
  }
}
